{
  "slug": "signup",
  "title": "Signup (Email + OTP)",
  "persona": "auth",
  "description": "New user registers with email and password, verifies via 6-digit OTP code, and gets a session. Includes invite auto-accept, cart merge, and recently-viewed merge as background side effects.",
  "relatedIssues": [159, 254],
  "flows": [
    {
      "id": "register",
      "title": "Register & Verify Email",
      "trigger": "User clicks Sign Up in navbar modal",
      "steps": [
        {
          "id": "open-modal",
          "label": "User clicks Sign Up → navbar modal opens",
          "layer": "client",
          "status": "built",
          "codeRef": "src/features/auth/components/register-form/index.tsx"
        },
        {
          "id": "enter-credentials",
          "label": "Enter email + password",
          "layer": "client",
          "status": "built",
          "notes": "Client-side validation: email format, password min 8 chars."
        },
        {
          "id": "submit-register",
          "label": "POST /api/auth/register (admin client creates user)",
          "layer": "server",
          "status": "built",
          "route": "POST /api/auth/register",
          "codeRef": "src/app/api/auth/register/route.ts",
          "notes": "Uses admin client to create user, bypassing email confirmation flow. Triggers Supabase to send OTP email.",
          "errorCases": [
            { "condition": "Email already registered", "result": "Show inline 'Sign in instead' link", "httpStatus": 409 }
          ]
        },
        {
          "id": "transition-to-otp",
          "label": "Form transitions to OTP input (same modal, no page change)",
          "layer": "client",
          "status": "built"
        },
        {
          "id": "enter-otp",
          "label": "User enters 6-digit code from email",
          "layer": "client",
          "status": "built",
          "codeRef": "src/features/auth/components/otp-input/index.tsx"
        },
        {
          "id": "verify-otp",
          "label": "verifyOtp(type='signup') → session established",
          "layer": "server",
          "status": "built",
          "notes": "On success, Supabase sets session cookies.",
          "errorCases": [
            { "condition": "Invalid/expired code", "result": "Show error, allow retry" }
          ]
        }
      ],
      "branches": [
        {
          "afterStep": "enter-otp",
          "condition": "Code not received?",
          "paths": [
            { "label": "Resend OTP (60s cooldown)", "goTo": "transition-to-otp" }
          ]
        }
      ]
    },
    {
      "id": "post-auth-side-effects",
      "title": "Post-Auth Background Side Effects",
      "trigger": "Session established after OTP verification",
      "steps": [
        {
          "id": "invite-check",
          "label": "Check if invite token was present in URL params",
          "layer": "background",
          "status": "built",
          "notes": "Token was stored in Navbar state from ?register=true&invite={token}. Threaded to OtpInput via props."
        },
        {
          "id": "auto-accept-invite",
          "label": "acceptShopInvite(token) — join shop automatically",
          "layer": "background",
          "status": "built",
          "codeRef": "src/features/shops/services/shop-invites.ts",
          "notes": "Only fires if invite token present. Failure never blocks — account is always created. See shop-invite-acceptance.json for full flow."
        },
        {
          "id": "cart-merge",
          "label": "useCartMerge() — merge localStorage cart to DB",
          "layer": "background",
          "status": "built",
          "codeRef": "src/features/cart/hooks/use-cart-merge.ts",
          "notes": "Silent. No toast. Fires on any auth state change. See guest-cart.json for full flow."
        },
        {
          "id": "recently-viewed-merge",
          "label": "useRecentlyViewedMerge() — merge localStorage views to DB",
          "layer": "background",
          "status": "built",
          "codeRef": "src/features/recently-viewed/hooks/use-recently-viewed-merge.ts",
          "notes": "Silent. POST /api/recently-viewed/merge. Deduplicates on server."
        },
        {
          "id": "onboarding-check",
          "label": "Check onboarding_completed_at on member record",
          "layer": "client",
          "status": "built",
          "notes": "If null → onboarding banner appears. If set → user stays on current page."
        }
      ]
    }
  ]
}
