{
  "slug": "guest-cart",
  "title": "Guest Cart → Login → Merge",
  "persona": "guest",
  "description": "Guest adds items to localStorage cart, logs in, and cart silently merges to the database.",
  "relatedIssues": [128, 129, 130],
  "flows": [
    {
      "id": "add-to-cart",
      "title": "Add Item to Guest Cart",
      "trigger": "Guest clicks 'Add to Cart' on listing detail page",
      "steps": [
        {
          "id": "click-add",
          "label": "Guest clicks 'Add to Cart' button",
          "layer": "client",
          "status": "built",
          "codeRef": "src/features/cart/components/add-to-cart-button/index.tsx"
        },
        {
          "id": "validate-client",
          "label": "Client-side validation (own listing, already in cart, cart full)",
          "layer": "client",
          "status": "built",
          "errorCases": [
            { "condition": "User's own listing", "result": "Button disabled" },
            { "condition": "Already in cart", "result": "Button shows 'In Cart'" },
            { "condition": "Cart has 25 items", "result": "Toast: cart full" }
          ]
        },
        {
          "id": "write-localstorage",
          "label": "Add item to localStorage cart (listingId + priceCents snapshot)",
          "layer": "background",
          "status": "built",
          "notes": "Guest cart is entirely localStorage-backed. No API calls."
        },
        {
          "id": "update-badge",
          "label": "CartIcon badge count updates via Zustand store",
          "layer": "client",
          "status": "built"
        },
        {
          "id": "show-toast",
          "label": "Toast: 'Added to cart'",
          "layer": "client",
          "status": "built"
        }
      ]
    },
    {
      "id": "view-cart",
      "title": "View Guest Cart",
      "trigger": "Guest navigates to /cart",
      "steps": [
        {
          "id": "load-cart",
          "label": "Read cart items from localStorage",
          "layer": "background",
          "status": "built"
        },
        {
          "id": "group-by-seller",
          "label": "Items grouped by seller for display",
          "layer": "client",
          "status": "built",
          "codeRef": "src/app/(frontend)/cart/page.tsx"
        },
        {
          "id": "show-items",
          "label": "Render cart items with remove/clear actions",
          "layer": "client",
          "status": "built",
          "notes": "Checkout button is disabled in MVP."
        }
      ],
      "branches": [
        {
          "afterStep": "load-cart",
          "condition": "Has items?",
          "paths": [
            { "label": "Yes", "goTo": "group-by-seller" },
            { "label": "No — show empty state + browse CTA", "goTo": "END" }
          ]
        }
      ]
    },
    {
      "id": "merge-on-login",
      "title": "Cart Merge on Login",
      "trigger": "Guest logs in with items in localStorage cart",
      "steps": [
        {
          "id": "login-detected",
          "label": "useCartMerge() detects auth state change",
          "layer": "background",
          "status": "built",
          "codeRef": "src/features/cart/hooks/use-cart-merge.ts",
          "notes": "This is a background hook — the user sees nothing. It fires on login regardless of what page they're on."
        },
        {
          "id": "read-guest-cart",
          "label": "Read localStorage cart items",
          "layer": "background",
          "status": "built"
        },
        {
          "id": "post-merge",
          "label": "POST /api/cart/merge with guest items",
          "layer": "server",
          "status": "built",
          "route": "POST /api/cart/merge",
          "notes": "Server validates every guest item: checks listing exists, not sold, not own listing, not already in DB cart."
        },
        {
          "id": "server-validate",
          "label": "Skip invalid/duplicate/own-listing items",
          "layer": "server",
          "status": "built",
          "notes": "No errors surfaced to user — invalid items are silently dropped."
        },
        {
          "id": "insert-valid",
          "label": "Insert valid items into cart table (DB)",
          "layer": "database",
          "status": "built"
        },
        {
          "id": "clear-localstorage",
          "label": "Clear localStorage guest cart",
          "layer": "background",
          "status": "built",
          "notes": "No toast, no redirect. Entirely silent. User's cart page now shows DB-backed items."
        }
      ]
    }
  ]
}
